[
  {
    "id": "kanazawa-research-institute",
    "sequence": 1,
    "title": "金澤研究所｜金沢研究所｜Kanazawa Research Institute",
    "nameZhHant": "金澤研究所",
    "nameJa": "金沢研究所",
    "nameEn": "Kanazawa Research Institute",
    "nameEnStatus": "geographic-or-romanized",
    "linkAliases": [
      "金澤研究所",
      "金澤綜合研究所",
      "金沢研究所",
      "金沢総合研究所",
      "金沢総合学術研究所",
      "Kanazawa Research Institute",
      "Kanazawa Scientific Research Lab"
    ],
    "mapType": "main",
    "isMainMap": true,
    "gameVersion": "maken-shao-ps2",
    "region": "JP",
    "confidence": "cross-verified",
    "verificationStatus": "partially-verified",
    "lastVerified": "2026-07-17",
    "summary": "固定開局與教學地圖；擊敗八卦安德烈後，魔劍切換宿主並前往林卡頓。",
    "story": "魔劍以相模桂開始行動，在研究所事故後迎戰八卦安德烈；完成後取得安德烈。",
    "structure": "單向研究設施流程，依序出現 Bazooka、Claw 與安德烈戰。",
    "requiredMapIds": [],
    "anyOfRequiredMapIds": [],
    "unlockNote": "固定開局，沒有前置地圖。",
    "obtainableCharacterIds": [
      "kei-sagami",
      "andrei"
    ],
    "enemies": [
      {
        "nameZhHant": "火箭筒兵",
        "nameJa": "バズーカ",
        "nameEn": "Bazooka",
        "type": "standard-enemy",
        "sourceIds": [
          "gamehyoron-maken-shao-earlygame"
        ]
      },
      {
        "nameZhHant": "爪兵",
        "nameJa": "クロウ",
        "nameEn": "Claw",
        "type": "standard-enemy",
        "sourceIds": [
          "gamehyoron-maken-shao-earlygame"
        ]
      },
      {
        "nameZhHant": "八卦安德烈",
        "nameJa": "八卦アンドレイ",
        "nameEn": "Hakke Andrei",
        "type": "boss",
        "sourceIds": [
          "gamehyoron-maken-shao-earlygame"
        ]
      }
    ],
    "walkthroughIds": [
      "route-opening-kanazawa"
    ],
    "sourceIds": [
      "atlus-maken-shao-index-archive",
      "gamehyoron-maken-shao-stage-index",
      "gamehyoron-maken-shao-earlygame",
      "gamehyoron-maken-shao-route-table",
      "kentaro-maken-shao-early-chart",
      "megaten-wiki-maken-x-locations"
    ],
    "images": [
      {
        "path": "assets/images/maps/kanazawa-research-institute-map-structure.webp",
        "alt": "Dreamcast《Maken X》中金澤研究所的Stage Preview 地圖構造畫面",
        "kind": "map-structure",
        "sourceId": "megaten-wiki-maken-x-locations",
        "fileTitle": "File:Maken X Kanazawa map.png",
        "filePageUrl": "https://megamitensei.fandom.com/wiki/File:Maken_X_Kanazawa_map.png",
        "fileRevisionId": 450943,
        "originalUrl": "https://static.wikia.nocookie.net/megamitensei/images/c/c8/Maken_X_Kanazawa_map.png/revision/latest?cb=20220214021037",
        "mime": "image/webp",
        "width": 512,
        "height": 256,
        "bytes": 32796,
        "sha256": "d86a8e5ec5111385b27bd49a66d7534a26492cae1f0a0f4776e0418b86acb3ba",
        "sourceMime": "image/png",
        "sourceWidth": 512,
        "sourceHeight": 256,
        "sourceBytes": 53643,
        "sourceSha1": "2ad346aadd877fb372bdc9883ac8ff94a8b13773",
        "sourceUploader": "Doctor of Faces",
        "sourceUploadedAt": "2022-02-14T02:10:37Z",
        "gameVersionScope": "maken-x-dreamcast",
        "associationNote": "MegaTen Wiki 的地圖頁將此檔列為 Kanazawa Research Institute 的《Maken X》Dreamcast 地點圖片。只用於跨版本視覺介紹；PS2 日版的劇情、前置條件、角色與敵人均由各自的日版來源核實。",
        "rightsNote": "遊戲畫面著作權屬原權利人；Wiki 檔案頁沒有提供明確再散布授權。本站依使用者指定，以縮至最長邊 640px 的 WebP、完整來源與權利警語作地圖辨識及評論，不主張圖像權利或自由再散布授權。",
        "derivativeUrl": "https://static.wikia.nocookie.net/megamitensei/images/c/c8/Maken_X_Kanazawa_map.png/revision/latest?cb=20220214021037",
        "associationPageUrl": "https://megamitensei.fandom.com/wiki/Kanazawa_Research_Institute",
        "associationPageRevisionId": 450949,
        "associationMethod": "location-page-image-list"
      },
      {
        "path": "assets/images/maps/kanazawa-research-institute-landmark-gameplay.webp",
        "alt": "Dreamcast《Maken X》中金澤研究所的標誌性遊戲場景畫面",
        "kind": "landmark-gameplay",
        "sourceId": "megaten-wiki-maken-x-locations",
        "fileTitle": "File:Maken X Kanazawa.png",
        "filePageUrl": "https://megamitensei.fandom.com/wiki/File:Maken_X_Kanazawa.png",
        "fileRevisionId": 450936,
        "originalUrl": "https://static.wikia.nocookie.net/megamitensei/images/f/fe/Maken_X_Kanazawa.png/revision/latest?cb=20220214020716",
        "mime": "image/webp",
        "width": 640,
        "height": 360,
        "bytes": 17720,
        "sha256": "12635a36f69f05688e744e504da353b601a8197f8b00366c99cd911bc22f53af",
        "sourceMime": "image/png",
        "sourceWidth": 1024,
        "sourceHeight": 576,
        "sourceBytes": 415684,
        "sourceSha1": "e3e3934da1eedc10c0514f854dec2b66f2d9d133",
        "sourceUploader": "Doctor of Faces",
        "sourceUploadedAt": "2022-02-14T02:07:16Z",
        "gameVersionScope": "maken-x-dreamcast",
        "associationNote": "MegaTen Wiki 的地圖頁將此檔列為 Kanazawa Research Institute 的《Maken X》Dreamcast 地點圖片。只用於跨版本視覺介紹；PS2 日版的劇情、前置條件、角色與敵人均由各自的日版來源核實。",
        "rightsNote": "遊戲畫面著作權屬原權利人；Wiki 檔案頁沒有提供明確再散布授權。本站依使用者指定，以縮至最長邊 640px 的 WebP、完整來源與權利警語作地圖辨識及評論，不主張圖像權利或自由再散布授權。",
        "derivativeUrl": "https://static.wikia.nocookie.net/megamitensei/images/f/fe/Maken_X_Kanazawa.png/revision/latest/scale-to-width-down/640?cb=20220214020716",
        "associationPageUrl": "https://megamitensei.fandom.com/wiki/Kanazawa_Research_Institute",
        "associationPageRevisionId": 450949,
        "associationMethod": "location-page-image-list"
      }
    ]
  },
  {
    "id": "linkardon",
    "sequence": 2,
    "title": "林卡頓｜リンカードン｜Linkardon",
    "nameZhHant": "林卡頓",
    "nameJa": "リンカードン",
    "nameEn": "Linkardon",
    "nameEnStatus": "geographic-or-romanized",
    "linkAliases": [
      "林卡頓",
      "リンカードン",
      "Linkardon",
      "Rhincodon"
    ],
    "mapType": "main",
    "isMainMap": true,
    "gameVersion": "maken-shao-ps2",
    "region": "JP",
    "confidence": "cross-verified",
    "verificationStatus": "partially-verified",
    "lastVerified": "2026-07-17",
    "summary": "固定第二張地圖；是否 Brain Jack 稻葉鄉會改變香港／泰姬瑪哈陵的早期入口。",
    "story": "安德烈進入飛行器；結尾可取得稻葉鄉，或保留安德烈走另一條早期路線。",
    "structure": "近似單一路徑的飛行器內部，包含大量射擊敵人、四名 Bazooka 的房間與限時事件。",
    "requiredMapIds": [
      "kanazawa-research-institute"
    ],
    "anyOfRequiredMapIds": [],
    "unlockNote": "完成金澤研究所後固定進入。",
    "obtainableCharacterIds": [
      "inaba-go"
    ],
    "enemies": [
      {
        "nameZhHant": "火箭筒兵",
        "nameJa": "バズーカ",
        "nameEn": "Bazooka",
        "type": "standard-enemy",
        "sourceIds": [
          "gamehyoron-maken-shao-earlygame"
        ]
      }
    ],
    "walkthroughIds": [
      "route-opening-lincardon"
    ],
    "sourceIds": [
      "gamehyoron-maken-shao-stage-index",
      "gamehyoron-maken-shao-earlygame",
      "gamehyoron-maken-shao-route-table",
      "kentaro-maken-shao-early-chart",
      "megaten-wiki-maken-x-locations"
    ],
    "images": [
      {
        "path": "assets/images/maps/linkardon-globe-marker.webp",
        "alt": "Dreamcast《Maken X》中林卡頓的地球儀地圖點畫面",
        "kind": "globe-marker",
        "sourceId": "megaten-wiki-maken-x-locations",
        "fileTitle": "File:Maken X Rhincodon location.png",
        "filePageUrl": "https://megamitensei.fandom.com/wiki/File:Maken_X_Rhincodon_location.png",
        "fileRevisionId": 451065,
        "originalUrl": "https://static.wikia.nocookie.net/megamitensei/images/9/9a/Maken_X_Rhincodon_location.png/revision/latest?cb=20220214094904",
        "mime": "image/webp",
        "width": 640,
        "height": 326,
        "bytes": 19352,
        "sha256": "5df7e4f2b3f0847e092298ab6d66179c4b2dc7b13975d28aba4480e4621d3efe",
        "sourceMime": "image/png",
        "sourceWidth": 1024,
        "sourceHeight": 521,
        "sourceBytes": 352932,
        "sourceSha1": "ab092fe616757226ae4bc15a9bf4c2c84f05ad8b",
        "sourceUploader": "Doctor of Faces",
        "sourceUploadedAt": "2022-02-14T09:49:04Z",
        "gameVersionScope": "maken-x-dreamcast",
        "associationNote": "MegaTen Wiki 的地圖頁將此檔列為 Linkardon 的《Maken X》Dreamcast 地點圖片。只用於跨版本視覺介紹；PS2 日版的劇情、前置條件、角色與敵人均由各自的日版來源核實。",
        "rightsNote": "遊戲畫面著作權屬原權利人；Wiki 檔案頁沒有提供明確再散布授權。本站依使用者指定，以縮至最長邊 640px 的 WebP、完整來源與權利警語作地圖辨識及評論，不主張圖像權利或自由再散布授權。",
        "derivativeUrl": "https://static.wikia.nocookie.net/megamitensei/images/9/9a/Maken_X_Rhincodon_location.png/revision/latest/scale-to-width-down/640?cb=20220214094904",
        "associationPageUrl": "https://megamitensei.fandom.com/wiki/Rhincodon",
        "associationPageRevisionId": 451090,
        "associationMethod": "location-page-image-list"
      },
      {
        "path": "assets/images/maps/linkardon-map-structure.webp",
        "alt": "Dreamcast《Maken X》中林卡頓的Stage Preview 地圖構造畫面",
        "kind": "map-structure",
        "sourceId": "megaten-wiki-maken-x-locations",
        "fileTitle": "File:Maken X Rhincodon map.png",
        "filePageUrl": "https://megamitensei.fandom.com/wiki/File:Maken_X_Rhincodon_map.png",
        "fileRevisionId": 451104,
        "originalUrl": "https://static.wikia.nocookie.net/megamitensei/images/4/41/Maken_X_Rhincodon_map.png/revision/latest?cb=20220214100627",
        "mime": "image/webp",
        "width": 512,
        "height": 256,
        "bytes": 30588,
        "sha256": "866bffb27a7ce42749958de76c0764429d14d440f1b31819f2f41ee5c62f0711",
        "sourceMime": "image/png",
        "sourceWidth": 512,
        "sourceHeight": 256,
        "sourceBytes": 50008,
        "sourceSha1": "952fb9f7db131b35f1420b3953cd7c9d2fe86f4a",
        "sourceUploader": "Doctor of Faces",
        "sourceUploadedAt": "2022-02-14T10:06:27Z",
        "gameVersionScope": "maken-x-dreamcast",
        "associationNote": "MegaTen Wiki 的地圖頁將此檔列為 Linkardon 的《Maken X》Dreamcast 地點圖片。只用於跨版本視覺介紹；PS2 日版的劇情、前置條件、角色與敵人均由各自的日版來源核實。",
        "rightsNote": "遊戲畫面著作權屬原權利人；Wiki 檔案頁沒有提供明確再散布授權。本站依使用者指定，以縮至最長邊 640px 的 WebP、完整來源與權利警語作地圖辨識及評論，不主張圖像權利或自由再散布授權。",